[
  {"schema_version":"1.0.0","event_type":"session.created","event_id":"evt-001","source":"orchestrator","time":"2026-07-08T00:00:00Z","trace_id":"trace-001","session_id":"session-001","seq":1,"data":{"created_at":"2026-07-08T00:00:00Z"}},
  {"schema_version":"1.0.0","event_type":"audience.input","event_id":"evt-002","source":"comments","time":"2026-07-08T00:00:01Z","trace_id":"trace-001","session_id":"session-001","turn_id":"turn-001","seq":2,"data":{"input_id":"input-001","origin":"comment","text":"What is bitnet?","received_at":"2026-07-08T00:00:01Z"}},
  {"schema_version":"1.0.0","event_type":"llm.request","event_id":"evt-003","source":"orchestrator","time":"2026-07-08T00:00:02Z","trace_id":"trace-001","session_id":"session-001","turn_id":"turn-001","seq":3,"data":{"request_id":"llm-001","prompt":"Explain quantization for the audience."}},
  {"schema_version":"1.0.0","event_type":"llm.response.final","event_id":"evt-004","source":"orchestrator","time":"2026-07-08T00:00:03Z","trace_id":"trace-001","session_id":"session-001","turn_id":"turn-001","seq":4,"data":{"request_id":"llm-001","text":"Quantization stores values with fewer bits.","finish_reason":"stop"}},
{"schema_version":"1.0.0","event_type":"mic.input.register","event_id":"evt-005","source":"mic","time":"2026-07-08T00:00:04Z","trace_id":"trace-001","session_id":"session-001","seq":5,"data":{"stream_id":"mic-stream-001"}},
{"schema_version":"1.0.0","event_type":"mic.input.ready","event_id":"evt-006","source":"orchestrator","time":"2026-07-08T00:00:05Z","trace_id":"trace-001","session_id":"session-001","seq":6,"data":{"stream_id":"mic-stream-001","input_epoch":1}},
{"schema_version":"1.0.0","event_type":"media.rtp.sink.register","event_id":"evt-007","source":"sound","time":"2026-07-08T00:00:06Z","trace_id":"trace-001","session_id":"session-001","seq":7,"data":{"stream_id":"mic-stream-001","codec":{"format":"L16","clock_rate_hz":16000,"channels":1,"payload_type":96,"samples_per_frame":320},"rtp_endpoint":{"host":"sound.example.test","port":5006}}},
{"schema_version":"1.0.0","event_type":"media.rtp.sink.ready","event_id":"evt-008","source":"sound","time":"2026-07-08T00:00:07Z","trace_id":"trace-001","session_id":"session-001","seq":8,"data":{"stream_id":"mic-stream-001"}},
{"schema_version":"1.0.0","event_type":"media.stream.command","event_id":"evt-009","source":"orchestrator","time":"2026-07-08T00:00:08Z","trace_id":"trace-001","session_id":"session-001","turn_id":"turn-001","seq":9,"data":{"command_id":"stream-command-001","stream_id":"mic-stream-001","start_rtp_timestamp":480000,"ssrc":305419896,"codec":{"format":"L16","clock_rate_hz":16000,"channels":1,"payload_type":96,"samples_per_frame":320},"cancellation_epoch":0,"rtp_sender_endpoint":{"host":"orchestrator.example.test","port":5004}}},
  {"schema_version":"1.0.0","event_type":"media.stream.state","event_id":"evt-010","source":"sound","time":"2026-07-08T00:00:09Z","trace_id":"trace-001","session_id":"session-001","turn_id":"turn-001","seq":10,"data":{"command_id":"stream-command-001","stream_id":"sound-stream-001","state":"playing","cancellation_epoch":0}},
  {"schema_version":"1.0.0","event_type":"vtuber.caption.command","event_id":"evt-011","source":"orchestrator","time":"2026-07-08T00:00:10Z","trace_id":"trace-001","session_id":"session-001","turn_id":"turn-001","seq":11,"data":{"caption_id":"caption-001","text":"Quantization stores values with fewer bits.","audio_stream_id":"sound-stream-001","start_at_ms":0,"end_at_ms":2200,"start_rtp_timestamp":480000,"end_rtp_timestamp":585600}},
  {"schema_version":"1.0.0","event_type":"vtuber.expression.command","event_id":"evt-012","source":"orchestrator","time":"2026-07-08T00:00:11Z","trace_id":"trace-001","session_id":"session-001","turn_id":"turn-001","seq":12,"data":{"expression_id":"expression-001","expression":"explaining","audio_stream_id":"sound-stream-001","start_at_ms":100,"end_at_ms":1200,"start_rtp_timestamp":484800,"end_rtp_timestamp":537600}},
  {"schema_version":"1.0.0","event_type":"vtuber.action.command","event_id":"evt-013","source":"orchestrator","time":"2026-07-08T00:00:12Z","trace_id":"trace-001","session_id":"session-001","turn_id":"turn-001","seq":13,"data":{"action_id":"action-001","action":"emphasis","audio_stream_id":"sound-stream-001","start_at_ms":100,"end_at_ms":1200,"start_rtp_timestamp":484800,"end_rtp_timestamp":537600}},
  {"schema_version":"1.0.0","event_type":"vtuber.scene.command","event_id":"evt-014","source":"orchestrator","time":"2026-07-08T00:00:13Z","trace_id":"trace-001","session_id":"session-001","seq":14,"data":{"scene_id":"scene-001","scene":"lecture_slide_focus","page":7}},
  {"schema_version":"1.0.0","event_type":"session.ended","event_id":"evt-015","source":"orchestrator","time":"2026-07-08T00:00:14Z","trace_id":"trace-001","session_id":"session-001","seq":15,"data":{"ended_at":"2026-07-08T00:00:14Z","reason":"host_stopped"}},
  {"schema_version":"1.0.0","event_type":"media.stream.flush","event_id":"evt-016","source":"orchestrator","time":"2026-07-08T00:00:15Z","trace_id":"trace-001","session_id":"session-001","turn_id":"turn-001","segment_id":"segment-001","seq":16,"data":{"stream_id":"sound-stream-001","cancellation_epoch":3,"request_id":"flush-001","target_generated_ssrc":305419896}},
  {"schema_version":"1.0.0","event_type":"media.stream.flush.ack","event_id":"evt-017","source":"sound","time":"2026-07-08T00:00:16Z","trace_id":"trace-001","session_id":"session-001","turn_id":"turn-001","segment_id":"segment-001","seq":17,"data":{"stream_id":"sound-stream-001","cancellation_epoch":3,"request_id":"flush-001","target_generated_ssrc":305419896,"disposition":"APPLIED"}},
  {"schema_version":"1.0.0","event_type":"presentation.load.command","event_id":"evt-018","source":"orchestrator","time":"2026-07-08T00:00:17Z","trace_id":"trace-001","session_id":"session-001","turn_id":"turn-001","seq":18,"data":{"command_id":"presentation-001","deck_id":"deck-intro","page":1}},
  {"schema_version":"1.0.0","event_type":"presentation.result","event_id":"evt-019","source":"frontend","time":"2026-07-08T00:00:18Z","trace_id":"trace-001","session_id":"session-001","turn_id":"turn-001","seq":19,"data":{"command_id":"presentation-001","succeeded":true,"reason":""}},
  {"schema_version":"1.1.0","event_type":"profile.enroll.command","event_id":"evt-020","source":"orchestrator","time":"2026-07-08T00:00:19Z","trace_id":"trace-001","session_id":"session-001","seq":20,"data":{"profile_id":"profile-001","preferred_name":"guest","evidence_id":"voice-evidence-001","consented":true}},
  {"schema_version":"1.1.0","event_type":"profile.revoke.command","event_id":"evt-021","source":"orchestrator","time":"2026-07-08T00:00:20Z","trace_id":"trace-001","session_id":"session-001","seq":21,"data":{"profile_id":"profile-001"}},
  {"schema_version":"1.1.0","event_type":"action.command","event_id":"evt-022","source":"orchestrator","time":"2026-07-08T00:00:21Z","trace_id":"trace-001","session_id":"session-001","seq":22,"data":{"command_id":"action-001","action":"act_cute"}},
  {"schema_version":"1.1.0","event_type":"action.result","event_id":"evt-023","source":"frontend","time":"2026-07-08T00:00:22Z","trace_id":"trace-001","session_id":"session-001","seq":23,"data":{"command_id":"action-001","succeeded":true}},
  {"schema_version":"1.2.0","event_type":"vtuber.cue.command","event_id":"evt-024","source":"orchestrator","time":"2026-07-08T00:00:23Z","trace_id":"trace-001","session_id":"session-001","turn_id":"turn-001","segment_id":"segment-cue","seq":24,"data":{"command_id":"avatar-turn-001","kind":"expression","name":"nod"}},
  {"schema_version":"1.2.0","event_type":"vtuber.cue.result","event_id":"evt-025","source":"frontend","time":"2026-07-08T00:00:23Z","trace_id":"trace-001","session_id":"session-001","turn_id":"turn-001","segment_id":"segment-cue","seq":25,"data":{"command_id":"avatar-turn-001","succeeded":true,"reason":""}}
]
